{
  "schemaVersion": 1,
  "coreVersion": "1.0.0",
  "mandatoryRoles": {
    "manifest-verifier": ["tools/check-shared-core.mjs", "tools/quality-policy/portable-core-contract.mjs"],
    "genericness-scanner": ["tools/check-generic-surface.mjs"],
    "shared-instructions-and-skills": [
      "tools/quality-policy/shared-instructions.md",
      ".agents/skills/preflight/SKILL.md",
      ".agents/skills/create-plan/SKILL.md",
      ".agents/skills/doc-sync/SKILL.md",
      ".agents/skills/scan-smells/SKILL.md",
      ".agents/skills/grill-me-repo/SKILL.md"
    ],
    "pattern-engine": [
      "tools/check-patterns/runner.mjs",
      "tools/check-patterns/shared.mjs",
      "tools/check-patterns/shared-source-scan.mjs",
      "tools/check-patterns/shared-suppressions.mjs",
      "tools/check-patterns/ast-utils.mjs",
      "tools/check-patterns/duplicate-utils.mjs",
      "tools/check-patterns/atomicity-parser.mjs",
      "tools/check-patterns/rules.mjs",
      "tools/check-patterns/rule-policy.mjs"
    ],
    "generic-rule-definitions": [
      "tools/check-patterns/generic/rules-atomicity-generic-defs.mjs",
      "tools/check-patterns/generic/rules-core-generic-defs.mjs",
      "tools/check-patterns/generic/rules-duplicates-defs.mjs",
      "tools/check-patterns/generic/rules-failfast-generic-defs.mjs",
      "tools/check-patterns/generic/rules-legacy-support-generic-defs.mjs",
      "tools/check-patterns/generic/rules-regex-generic-defs.mjs",
      "tools/check-patterns/generic/rules-responsive-generic-defs.mjs",
      "tools/check-patterns/generic/rules-unsafe-sink-defs.mjs",
      "tools/check-patterns/generic/namespace-policy.mjs"
    ],
    "file-size-checker": [
      "tools/check-file-size.mjs",
      "tools/check-file-size/scan-helpers.mjs",
      "tools/check-file-size/oneliner-rules.mjs",
      "tools/check-file-size/collapsed-literal-rules.mjs"
    ],
    "focused-test-checker": ["tools/check-test-focus.mjs"],
    "schema-checker": ["tools/check-schema.mjs", "schemas/portable-core-contract.schema.json"],
    "documentation-checkers": ["tools/check-doc-links.mjs", "tools/check-doc-links-proof.mjs"],
    "hook-framework": ["tools/hooks-install.mjs", "tools/hooks-doctor.mjs"],
    "formatting-framework": ["tools/quality-policy/run-format.mjs", "tools/quality-policy/generate-format-scope.mjs"],
    "complexity-policy": [
      "tools/quality-policy/complexity-scan.mjs",
      "tools/quality-policy/complexity-budget.mjs",
      "tools/quality-policy/complexity-capture-integrity.mjs"
    ],
    "coverage-policy": [
      "tools/quality-policy/check-coverage-inventory.mjs",
      "tools/quality-policy/coverage-summary-adapter.mjs"
    ],
    "test-inventory-policy": ["tools/quality-policy/test-inventory.mjs"],
    "release-interfaces": [
      "tools/quality-policy/release-path-core.mjs",
      "tools/release-version.mjs",
      "tools/quality-policy/semver-corpus.json",
      "tests/tools/release-version-semver-corpus.test.js"
    ],
    "strict-lint-rules": ["tools/quality-policy/eslint-shared-rules.mjs"],
    "portable-core-self-tests": [
      "tests/portable-core/portable-core-contract.test.js",
      "tests/portable-core/generic-rule-corpus.json"
    ],
    "standalone-boundary": ["tools/check-standalone-boundary.mjs"],
    "suppression-scanner": ["tools/check-suppressions.mjs"],
    "profile-validation": ["tools/quality-policy/profile-schema.mjs"]
  },
  "mandatoryPaths": [
    ".agents/skills/create-plan/SKILL.md",
    ".agents/skills/doc-sync/SKILL.md",
    ".agents/skills/grill-me-repo/SKILL.md",
    ".agents/skills/preflight/SKILL.md",
    ".agents/skills/scan-smells/SKILL.md",
    "schemas/portable-core-contract.schema.json",
    "tests/portable-core/generic-rule-corpus.json",
    "tests/portable-core/portable-core-contract.test.js",
    "tools/check-doc-links-proof.mjs",
    "tools/check-doc-links.mjs",
    "tools/check-standalone-boundary.mjs",
    "tools/check-suppressions.mjs",
    "tools/check-file-size.mjs",
    "tools/check-file-size/collapsed-literal-rules.mjs",
    "tools/check-file-size/oneliner-rules.mjs",
    "tools/check-file-size/scan-helpers.mjs",
    "tools/check-generic-surface.mjs",
    "tools/check-patterns/runner.mjs",
    "tools/check-patterns/ast-utils.mjs",
    "tools/check-patterns/atomicity-parser.mjs",
    "tools/check-patterns/duplicate-utils.mjs",
    "tools/check-patterns/generic/namespace-policy.mjs",
    "tools/check-patterns/generic/rules-atomicity-generic-defs.mjs",
    "tools/check-patterns/generic/rules-core-generic-defs.mjs",
    "tools/check-patterns/generic/rules-duplicates-defs.mjs",
    "tools/check-patterns/generic/rules-failfast-generic-defs.mjs",
    "tools/check-patterns/generic/rules-legacy-support-generic-defs.mjs",
    "tools/check-patterns/generic/rules-regex-generic-defs.mjs",
    "tools/check-patterns/generic/rules-responsive-generic-defs.mjs",
    "tools/check-patterns/generic/rules-unsafe-sink-defs.mjs",
    "tools/check-patterns/rule-policy.mjs",
    "tools/check-patterns/rules.mjs",
    "tools/check-patterns/shared-suppressions.mjs",
    "tools/check-patterns/shared-source-scan.mjs",
    "tools/check-patterns/shared.mjs",
    "tools/check-schema.mjs",
    "tools/check-shared-core.mjs",
    "tools/check-test-focus.mjs",
    "tools/hooks-doctor.mjs",
    "tools/hooks-install.mjs",
    "tools/quality-policy/check-coverage-inventory.mjs",
    "tools/quality-policy/complexity-budget.mjs",
    "tools/quality-policy/complexity-capture-integrity.mjs",
    "tools/quality-policy/complexity-scan.mjs",
    "tools/quality-policy/coverage-summary-adapter.mjs",
    "tools/quality-policy/eslint-shared-rules.mjs",
    "tools/quality-policy/generate-format-scope.mjs",
    "tools/quality-policy/portable-core-contract.mjs",
    "tools/quality-policy/profile-schema.mjs",
    "tools/quality-policy/release-path-core.mjs",
    "tools/quality-policy/run-format.mjs",
    "tools/quality-policy/shared-instructions.md",
    "tools/quality-policy/test-inventory.mjs",
    "tools/portable-core-attest.mjs",
    "tools/release-version.mjs",
    "tools/quality-policy/semver-corpus.json",
    "tests/tools/release-version-semver-corpus.test.js"
  ],
  "metadataPaths": [
    "schemas/portable-core-contract.schema.json",
    "tools/quality-policy/portable-core-contract.json",
    "tools/quality-policy/shared-core-manifest.json",
    "tools/quality-policy/shared-core-manifest.sha256"
  ],
  "profileSchemas": [
    "tools/quality-policy/generic-tokens.json",
    "tools/quality-policy/project-file-size-scope.json",
    "tools/quality-policy/project-pattern-scopes.json",
    "tools/quality-policy/project-pattern-context.json",
    "tools/quality-policy/project-schema-profile.json",
    "tools/quality-policy/project-test-inventory-policy.json",
    "tools/quality-policy/project-format-scope.json",
    "tools/quality-policy/project-coverage-inventory-policy.json",
    "tools/quality-policy/project-complexity-scope.json",
    "tools/quality-policy/semver-corpus.json"
  ],
  "canonicalRuleIds": [
    "absolute-home-path",
    "exec-plan-reference",
    "no-nul-byte",
    "unsafe-html-dom-sink",
    "dead-code",
    "console-in-runtime",
    "default-truthy-fallback",
    "redundant-null-type-guard",
    "empty-catch",
    "premature-legacy-support",
    "unused-fallback",
    "responsive-layout-hard-floor",
    "canvas-api-typeof-guard",
    "try-finally-canvas-drawing",
    "todo-without-owner",
    "duplicate-functions",
    "duplicate-block-clones",
    "catch-fallback-without-suppression",
    "internal-contract-fallback",
    "framework-method-typeof-guard",
    "invalid-lint-suppression"
  ],
  "requiredCheckerExports": {
    "tools/check-shared-core.mjs": ["runSharedCoreCheck"],
    "tools/check-patterns/runner.mjs": ["runPatternCheck"],
    "tools/check-generic-surface.mjs": ["runGenericSurfaceCheck"],
    "tools/check-file-size.mjs": ["runFileSizeCheck"],
    "tools/check-test-focus.mjs": ["runTestFocusCheck"],
    "tools/check-schema.mjs": ["runSchemaCheck"],
    "tools/check-doc-links.mjs": ["runDocLinksCheck"],
    "tools/check-doc-links-proof.mjs": ["runDocLinksProof"],
    "tools/check-standalone-boundary.mjs": ["runStandaloneBoundaryCheck"],
    "tools/check-suppressions.mjs": ["runSuppressionCheck"],
    "tools/quality-policy/complexity-scan.mjs": ["runComplexityScan"],
    "tools/quality-policy/check-coverage-inventory.mjs": ["runCoverageInventoryCheck"],
    "tools/hooks-install.mjs": ["runHooksInstall"],
    "tools/hooks-doctor.mjs": ["runHooksDoctorCheck"],
    "tools/portable-core-attest.mjs": ["runPortableCoreAttestation"],
    "tools/quality-policy/run-format.mjs": ["runFormat"],
    "tools/quality-policy/test-inventory.mjs": ["runTestInventoryCheck"]
  },
  "requiredSelfTestRoles": {
    "manifest": "tests/portable-core/portable-core-contract.test.js",
    "attestation": "tests/portable-core/portable-core-contract.test.js",
    "standalone-boundary": "tests/portable-core/portable-core-contract.test.js",
    "suppression-scanner": "tests/portable-core/portable-core-contract.test.js"
  }
}
